adult,backdrop_path,genre_ids,id,title,original_language,original_title,overview,popularity,poster_path,release_date,softcore,video,vote_average,vote_count
False,/96chPcURxg5thGyLqxO6otyxHFR.jpg,"[28, 35, 12, 80]",1169516,Welcome to the Jungle,hi,Welcome to the Jungle,"A group of quirky characters gets stuck in a dangerous jungle during a chaotic mission. Filled with confusion, criminals, and hilarious situations, they must work together to survive and find their way out.",1112.1374,/1JlfUuvvX5xLP2LIDah4JhWUtTx.jpg,2026-06-25,False,False,0.0,0
False,/6tROOVmV5vRymO2g52aR8kWlfoT.jpg,"[10749, 35]",1392469,Cocktail 2,hi,कॉकटेल २,"After a decade together, Diya and Kunal's relationship is shaken when Ally, an old friend, re-enters their lives. What begins as a plan between two women spirals into chaos, triggering hilarious, emotional rollercoaster none of them saw coming.",492.3923,/oIQmtByV1LtEQSwM4EpdLTyoSlM.jpg,2026-06-19,False,False,5.625,16
False,/5lTZyuBTNOfawsfPT8Q0cIg6qAF.jpg,"[27, 53]",1339713,Obsession,en,Obsession,"After breaking the mysterious ""One Wish Willow"" to win his crush's heart, a hopeless romantic finds himself getting exactly what he asked for but soon discovers that some desires come at a dark, sinister price.",487.4195,/bRwnj8WEKBCvmfeUNOukJPwB43K.jpg,2026-05-13,False,False,7.9,1002
False,/ufSwlnECLoUbBjPrFqEQcWBzHwc.jpg,"[10402, 18]",936075,Michael,en,Michael,"The story of Michael Jackson, one of the most influential artists the world has ever known, and his life beyond the music. His journey from the discovery of his extraordinary talent as the lead of the Jackson Five, to the visionary artist whose creative ambition fueled a relentless pursuit to become the biggest entertainer in the world, highlighting both his life off-stage and some of the most iconic performances from his early solo career.",346.6964,/zm0KAbOjlt9eR5y7vDiL2dEOwMl.jpg,2026-04-22,False,False,8.698,3059
False,/qjTqY5coNiz6sVtPng40IzltsoN.jpg,"[16, 10751, 35, 12]",1084244,Toy Story 5,en,Toy Story 5,"When Bonnie receives a Lilypad tablet as a gift and becomes obsessed, Buzz, Woody, Jessie and the rest of the gang's jobs become exponentially harder when they have to go head to head with the all-new threat to playtime.",489.721,/pxG26JdyuiDvJbSoucknaFiLeZD.jpg,2026-06-17,False,False,7.467,332
False,/vk5IwZNS35wh6rNmqB1ns6XuiyI.jpg,"[28, 12, 878]",1081003,Supergirl,en,Supergirl,"When an unexpected and ruthless adversary strikes too close to home, Kara Zor-El, aka Supergirl, reluctantly joins forces with an unlikely companion on an epic, interstellar journey of vengeance and justice.",321.6545,/niSvU02l2BONH9ivubV6K1a5QiK.jpg,2026-06-24,False,False,6.138,174
False,/laR2dpcNpbv83jdlRUNAYPPjH90.jpg,"[28, 14, 12]",931285,Mortal Kombat II,en,Mortal Kombat II,"The fan favorite champions—now joined by Johnny Cage himself—are pitted against one another in the ultimate, no-holds barred, gory battle to defeat the dark rule of Shao Kahn that threatens the very existence of the Earthrealm and its defenders.",267.5039,/hwRdDFIhaEmpRgoki805YvyyjZf.jpg,2026-05-06,False,False,7.981,1694
False,/iYjlQzWbcFIjWe2WifbEPb4kErp.jpg,"[53, 27]",1127384,Deep Water,en,Deep Water,A group of international passengers on a flight from Los Angeles to Shanghai is forced to make an emergency landing in shark-infested waters. The terrified group is forced to work together and overcome their differences if they hope to escape their sinking plane and the frenzy of sharks drawn to the wreckage.,298.9954,/kjcuS7xaRyqRjVaVcH4t0qHshuX.jpg,2026-04-30,False,False,6.146,65
False,/A2tzVTVtnTvpji96IZmleN78KKv.jpg,"[27, 35]",1239134,Bhooth Bangla,hi,भूत बंगला,"A man inherits a palace in rural Mangalpur and plans his sister's wedding there, but strange supernatural events and panicked locals force him to investigate the property's mysterious past.",242.7675,/ArIS4vwUxdhm3j7tsTHmffdfU8W.jpg,2026-04-16,False,False,5.6,40
False,/s6ly8laenkHWlIBRkLSfIuEMLC6.jpg,"[878, 53]",1275779,Disclosure Day,en,Disclosure Day,"A cybersecurity expert becomes a whistleblower after uncovering secrets about aliens, putting him on the run from a corporation. Meanwhile, a meteorologist experiencing strange phenomena joins forces with him to prove there's life beyond our understanding.",421.7161,/3o5YPjDGDTcTDL5ftDA9NwN9dLd.jpg,2026-06-10,False,False,6.693,690
False,/7TJjD2X9GTEqyLVIJKLS85J2V47.jpg,"[53, 28, 80]",28322,Madness,it,Vacanze per un massacro,"An escaped convicted murderer invades the cottage of a man, his wife and the wife's sister, whereupon he proceeds to torment this already dysfunctional trio with rape and violence.",197.8261,/gV0J0Fqw2mYMtQbzb0ruxv9MAeZ.jpg,1980-03-20,False,False,5.1,33
False,/1x9e0qWonw634NhIsRdvnneeqvN.jpg,[10749],1523145,Your Heart Will Be Broken,ru,Твоё сердце будет разбито,"High school student Polina is saved from bullying at her new school and makes a deal with the main bully Bars: he must pretend to be her boyfriend and protect her, and she must do everything he says. During this game, the couple develops real feelings, but her family and classmates have reasons to separate the lovers.",250.5682,/7wIBfBl2gejt6xHxNSK0reVIm7E.jpg,2026-03-26,False,False,7.058,103
False,/t6O6XWelu27BD0OmIDCCufZZT6d.jpg,"[35, 80, 9648, 10751]",1301421,The Sheep Detectives,en,The Sheep Detectives,"George Hardy is a shepherd who reads detective novels to his beloved sheep every night, assuming they can't possibly understand. But when a mysterious incident disrupts life on the farm, the sheep realize they must become the detectives. As they follow the clues and investigate human suspects, they prove that even sheep can be brilliant crime-solvers.",273.4522,/iKy5460GdsoknM8ppmGlJbKxAKa.jpg,2026-04-30,False,False,7.738,399
False,/krhj4Fhb0G3QCmyBtEADxgFFmRX.jpg,"[18, 10749]",11012,Damage,en,Damage,The life of a respected British politician at the height of his career crumbles when he becomes obsessed with his son's lover.,187.6766,/alf3JOPP7EYP0iO24gwe5YfRnqo.jpg,1992-12-02,False,False,6.6,696
False,/emK2hOB6ACiExT0lNLog9lAmMFL.jpg,"[18, 10749]",1226293,Salitan,tl,Salitan,A suspicious wife follows her husband in Bali. She meets a dashing man who captures her heart. She soon wants her husband to really have an affair to alleviate the guilt she is feeling.,236.9562,/rMgG7cWuq9O6zhhLs2CbqIKVA8V.jpg,2024-02-16,False,False,4.4,10
False,/z18AIGSU0vk4Y7LQP37CPSeKZvF.jpg,"[18, 28, 10751, 53]",1515729,Blast,ta,Blast,Follows a family trained to protect the powerless who become the most dangerous obstacle of all.,256.2052,/ho824aZtnBzE6FuJRn2znQCq4qQ.jpg,2026-05-28,False,False,7.2,11
False,/2WU6Y6aonzD6uAaCmNnEFlesxxJ.jpg,"[10749, 35]",614945,Voicemails for Isabelle,en,Voicemails for Isabelle,"A young woman's hilariously confessional voicemails to her late sister are unknowingly redirected to a stranger, who begins to fall in love from afar.",177.7415,/canZTWSxACSnAluir3dCtMxKpA1.jpg,2026-06-20,False,False,8.264,278
False,/4lj7MZtcIDI2FmZXGkFWh0sNCsq.jpg,"[28, 12, 878]",1228710,The Mandalorian and Grogu,en,The Mandalorian and Grogu,"The evil Empire has fallen, and Imperial warlords remain scattered throughout the galaxy. As the fledgling New Republic works to protect everything the Rebellion fought for, they have enlisted the help of legendary Mandalorian bounty hunter Din Djarin and his young apprentice Grogu.",176.917,/5Vi8dSauVwH1HOsiZceDMbRr1Ca.jpg,2026-05-20,False,False,6.685,525
False,/9Z2uDYXqJrlmePznQQJhL6d92Rq.jpg,"[10751, 35, 12, 14, 16]",1226863,The Super Mario Galaxy Movie,en,The Super Mario Galaxy Movie,"Having thwarted Bowser's previous plot to marry Princess Peach, Mario and Luigi now face a fresh threat in Bowser Jr., who is determined to liberate his father from captivity and restore the family legacy. Alongside companions new and old, the brothers travel across the stars to stop the young heir's crusade.",180.9182,/eJGWx219ZcEMVQJhAgMiqo8tYY.jpg,2026-04-01,False,False,8.229,2839
False,/wQOhbCP6H8bO5ddlXDZT207orew.jpg,"[10749, 18]",1477317,Your Fault: London,en,Your Fault: London,"Nick and Noah are both embarking on life-changing adventures that are threatening to pull them apart—Nick in business with his father and Noah starting a fresh chapter at Oxford University. Now living separate lives, and meeting new people, they find themselves entangled in temptations, rivalries, and betrayals and their bond is tested like never before. As secrets unravel and temptation rises, they must fight to hold onto each other—or risk losing everything.",150.3474,/nLxu237EJAisFCYKK48hN9Plobx.jpg,2026-06-17,False,False,7.504,132
False,/dxyNrJ4uG9os6miCG7s754nvKPs.jpg,"[28, 80]",1280738,The Furious,zh,火遮眼,"After Wang Wei's daughter is kidnapped by a criminal network and he receives no help from the corrupt police, Wei sets out to find her himself. His only ally is Navin, a relentless journalist whose wife has mysteriously disappeared. Fueled by a furious vengeance, the unlikely duo ruthlessly battle the kidnappers in this explosive martial arts showdown.",150.6088,/zP19YO60jwEsfKd5Qf1UvA5uJu8.jpg,2026-06-10,False,False,7.685,65
False,/1eAuwNBy34kkM3xkl202z4f1NiI.jpg,"[28, 14]",1367220,Karuppu,ta,கருப்பு,"In a world where justice falters, guardian deity Vettai Karuppu takes the guise of a lawyer to battle a corrupt legal system preying on the powerless.",141.6351,/4KZXlZ5tTT6ghbW77gS4hSLkCd7.jpg,2026-05-14,False,False,6.737,19
False,/oUozq2XHWifwAVOoS1qHU0qfXqM.jpg,"[27, 9648, 878]",1083381,Backrooms,en,Backrooms,A strange doorway appears in the basement of a furniture showroom.,255.827,/rhGx6E3qRNMgj3i5su2oukNHwIQ.jpg,2026-05-27,False,False,6.895,749
False,/zMwhWailP1WY7sb6AoE6b8ugoy.jpg,"[12, 16, 10751, 14]",1007757,Swapped,en,Swapped,"A small woodland creature and a majestic bird, two natural sworn enemies of the Valley, magically trade places and set off on an adventure of a lifetime to switch back. Their journey soon uncovers a greater threat—one that could endanger not only their species, but the entire valley they call home.",141.0472,/tHhxWxge06goXU6ZQH1hj7vK8Hd.jpg,2026-05-01,False,False,8.956,1811
False,/u8DU5fkLoM5tTRukzPC31oGPxaQ.jpg,"[878, 12, 14]",83533,Avatar: Fire and Ash,en,Avatar: Fire and Ash,"In the wake of the devastating war against the RDA and the loss of their eldest son, Jake Sully and Neytiri face a new threat on Pandora: the Ash People, a violent and power-hungry Na'vi tribe led by the ruthless Varang. Jake's family must fight for their survival and the future of Pandora in a conflict that pushes them to their emotional and physical limits.",143.6235,/bRBeSHfGHwkEpImlhxPmOcUsaeg.jpg,2025-12-17,False,False,7.602,3580
False,/bdwv8Hsu4Bnz8aRbH5MQ9clQ0DG.jpg,[35],1397385,Little Brother,en,Little Brother,"A tightly wound realtor's picture-perfect life gets an extreme makeover when his lovably chaotic ""little brother"" suddenly reappears.",140.3757,/hIJpXb7Xaje2mebN9ylsS7blQzP.jpg,2026-06-18,False,False,6.4,65
False,/l1nekhf05HS5OpBr0vRqcD3NxoS.jpg,"[36, 80, 28, 14]",1103473,KD – The Devil,kn,ಕೆಡಿ - ದಿ ಡೆವಿಲ್,"In the early 1970s, a petty criminal Kaali unwittingly involves himself with underworld thugs, catalyzing events beyond his control.",140.4151,/nEuEMJrnLBneE9tJlmzbhCFLu95.jpg,2026-04-30,False,False,7.5,2
False,/xugEpZk9YQ0DIz1aFvH5HGkqpZK.jpg,"[27, 9648]",1304313,Lee Cronin's The Mummy,en,Lee Cronin's The Mummy,"The young daughter of a journalist disappears into the desert without a trace—eight years later, the broken family is shocked when she is returned to them, as what should be a joyful reunion turns into a living nightmare.",138.254,/1q308iixueCU4pFtSYugNOevtNx.jpg,2026-04-15,False,False,8.022,1989
False,/rHnANzYUmV3WZw3n0yWOLiR3pen.jpg,"[53, 80]",976912,Graphic Desires,en,Graphic Desires,"When reclusive Franklin cheats on his partner with a mysterious girl he meets on a dating app, it becomes the start of a deadly obsession.",137.3781,/3BjLdTWRiHc1ISIZMFvToOmghOM.jpg,2023-08-31,False,False,7.093,108
False,/3Rfvhy1Nl6sSGJwyjb0QiZzZYlB.jpg,"[10751, 35, 16, 12]",862,Toy Story,en,Toy Story,"Led by Woody, Andy's toys live happily in his room until Andy's birthday brings Buzz Lightyear onto the scene. Afraid of losing his place in Andy's heart, Woody plots against Buzz. But when circumstances separate Buzz and Woody from their owner, the duo eventually learns to put aside their differences.",128.2475,/uXDfjJbdP4ijW5hWSBrPrlKpxab.jpg,1995-11-22,False,False,7.978,20034
False,/oPsRr7AfNLw6XaPuMpvkWK0bIUA.jpg,"[28, 18]",1057265,Peddi,te,పెద్ది,"In 1980s rural Andhra Pradesh, a spirited villager unites his community through sports to defend their pride against a powerful rivals.",125.023,/kJAJNNBYlbqAcpTDxBNnaILSMTy.jpg,2026-06-03,False,False,6.029,52
False,/8Tfys3mDZVp4tNoH2ktm06a0Tau.jpg,"[878, 12]",687163,Project Hail Mary,en,Project Hail Mary,"Science teacher Ryland Grace wakes up on a spaceship light years from home with no recollection of who he is or how he got there. As his memory returns, he begins to uncover his mission: solve the riddle of the mysterious substance causing the sun to die out. He must call on his scientific knowledge and unorthodox ideas to save everything on Earth from extinction.",134.8004,/yihdXomYb5kTeSivtFndMy5iDmf.jpg,2026-03-15,False,False,8.688,5424
False,/q62bpQ67qaXY0u6b2wFEnQYIbPd.jpg,"[10751, 35, 16, 12]",301528,Toy Story 4,en,Toy Story 4,"Woody has always been confident about his place in the world, devoted to taking care of his kid—whether that's Andy or Bonnie. But after Bonnie creates a reluctant new toy called ""Forky"", a road trip adventure alongside old and new friends challenges everything Woody believes about loyalty, purpose, and what it truly means to be a toy.",131.9876,/w9kR8qbmQ01HwnvK4alvnQ2ca0L.jpg,2019-06-19,False,False,7.461,10637
False,/qO55CD8tgVL1T4WKn6zYFFiD6lL.jpg,"[28, 18, 80]",1439930,The Punisher: One Last Kill,en,The Punisher: One Last Kill,"As Frank Castle searches for meaning beyond revenge, an unexpected force pulls him back into the fight.",125.4863,/qQclTgLMDvGBuUBFGHRipxkEwWR.jpg,2026-05-12,False,False,8.343,1726
False,/piV2OnzTZCyGBP9JCjlHIgKGlfo.jpg,"[28, 14, 878]",454639,Masters of the Universe,en,Masters of the Universe,"After being separated for 15 years, the Sword of Power leads Prince Adam back to Eternia, where he discovers his home shattered under the fiendish rule of Skeletor. To save his family and his world, Adam must join forces with his closest allies, Teela and Duncan/Man-At-Arms, and embrace his true destiny as He-Man — the most powerful man in the universe.",126.2101,/3YMd9Ogae4rDKLWuAZFuse9xhc5.jpg,2026-06-03,False,False,7.157,318
False,/br4Ra4dRpvR0R7a1zPPkOwGkcky.jpg,"[28, 80, 53]",1582770,Dhurandhar: The Revenge,hi,धुरंधर: द रिवेंज,"As rival gangs, corrupt officials and a ruthless Major Iqbal close in, Hamza's mission for his country spirals into a bloody personal war where the line between patriot and monster disappears in the streets of Lyari.",118.4381,/ptTwQES14pr5c3aZvJg56YlYgb1.jpg,2026-03-18,False,False,7.355,124
False,/qcIKxhqGMIj8uujsSoSMZWr8QqU.jpg,"[28, 53]",1122573,In the Grey,en,In the Grey,"A covert team of elite operatives are living in the shadows. When a ruthless despot steals a billion-dollar fortune, they're sent to take it back—an impossible heist that erupts into a deadly game of strategy, deception and survival.",111.9278,/dQgIcW6Th08kMRf2HBoYWoFE6OD.jpg,2026-05-13,False,False,6.624,275
False,/bWw9PuPH6vFXlezBoHZ6D9XBhQW.jpg,"[10749, 18]",1431068,Main Vaapas Aaunga,hi,मैं वापस आऊंगा,"An elderly man remains haunted by a childhood romance and memories of love lost during the 1947 Partition of India. As he shares his story with his grandson, the past unfolds through memories of migration, longing, and a love that endures across generations.",96.5214,/8n7OeeyAqwmGS81Is2c6Ho65tgW.jpg,2026-06-10,False,False,6.857,7
False,/1RgPyOhN4DRs225BGTlHJqCudII.jpg,"[16, 28, 14]",1311031,Demon Slayer: Kimetsu no Yaiba Infinity Castle,ja,劇場版「鬼滅の刃」無限城編 第一章 猗窩座再来,"The Demon Slayer Corps are drawn into the Infinity Castle, where Tanjiro, Nezuko, and the Hashira face terrifying Upper Rank demons in a desperate fight as the final battle against Muzan Kibutsuji begins.",101.7643,/fWVSwgjpT2D78VUh6X8UBd2rorW.jpg,2025-07-18,False,False,7.7,874
False,/3Ckkdh0VTcFPwpBJ6jMAS3qIkgJ.jpg,"[53, 28, 80]",1413976,Citizen Vigilante,en,Citizen Vigilante,"A man takes justice into his own hands, hunting down criminals. His vigilante crusade makes him a social media star but puts him at odds with the local police chief.",103.9019,/6LmJD3Wohe0g4U62wgi7RyJqfE4.jpg,2026-06-19,False,False,7.0,85
False,/u53UYu5XG2hNgWGvs3xGhAVzypl.jpg,"[12, 16, 35, 10751, 878]",1327819,Hoppers,en,Hoppers,"Scientists have discovered how to 'hop' human consciousness into lifelike robotic animals, allowing people to communicate with animals as animals. Animal lover Mabel seizes an opportunity to use the technology, uncovering mysteries within the animal world beyond anything she could have imagined.",101.8301,/xjtWQ2CL1mpmMNwuU5HeS4Iuwuu.jpg,2026-03-04,False,False,8.193,1742
False,/l5QgEvlfK6eHPM4YPEk7AArXmh8.jpg,"[10749, 35]",1308553,Hai Jawani Toh Ishq Hona Hai,hi,है जवानी तो इश्क होना है,"When Jass leaves his marriage over conflicting priorities, a new romance abroad is upended by shocking revelations, forcing him to confront love, loyalty, and the true meaning of commitment.",91.3167,/vmlJvz6qVzYgei2V74GvnmcuQfW.jpg,2026-06-04,False,False,5.5,20
False,,[10749],479787,Lost Youth,ko,버려진 청춘,,97.1043,/2ty3Bx6ENkZlorh6NP6jzNcEUtL.jpg,1982-09-24,False,False,0.0,0
False,/wVg11RahrRfghgqViuoJgcJL1iM.jpg,[35],264980,Loves of a French Pussycat,de,Das Mädchen mit der heißen Masche,"Rolf, a sex-advice columnist and a lecher, has affairs with numerous women, but never a permanent relationship. Suzanne, one of his ex-lovers, offers to bet that no woman can get Rolf to propose marriage, a bet her girlfriend Andrea eagerly accepts. But there's a catch: To win the bet, Andrea must get the womanizing Rolf to commit to marriage without first going to bed with him.",71.3553,/1WGq9cMuj09tnTJ5wdkINOJff04.jpg,1972-03-09,False,False,4.2,9
False,/sS3zGYFPcfM5pArVNWl6qLyaSmU.jpg,"[28, 12, 16, 14]",980431,Avatar Aang: The Last Airbender,en,Avatar Aang: The Last Airbender,"Avatar Aang, the world's last Airbender, learns of an ancient power that could save his culture from extinction. With the help of his friends, he embarks on a global quest to find it before it falls into the wrong hands and threatens to upend the peace they sacrificed everything to achieve.",105.7293,/29Jdsak3SrwGds5k1t43kH6Khed.jpg,2026-10-09,False,False,0.0,0
False,/2pA5fvLPZGYR5OukwiRCeliHvNM.jpg,"[28, 53, 18]",1227241,Maa Inti Bangaram,te,మా ఇంటి బంగారం,"Through both her moments of fear and bravery, a woman discovers that embracing her vulnerabilities is as vital to her inner strength as facing challenges head-on.",87.6661,/n7X5JZLzqzUxwdn9Mwx9cegEnBv.jpg,2026-06-18,False,False,6.3,3
False,/zfbjgQE1uSd9wiPTX4VzsLi0rGG.jpg,"[18, 80]",278,The Shawshank Redemption,en,The Shawshank Redemption,"Imprisoned in the 1940s for the double murder of his wife and her lover, upstanding banker Andy Dufresne begins a new life at the Shawshank prison, where he puts his accounting skills to work for an amoral warden. During his long stretch in prison, Dufresne comes to be admired by the other inmates -- including an older prisoner named Red -- for his integrity and unquenchable sense of hope.",107.2232,/9cqNxx0GxF0bflZmeSMuL5tnGzr.jpg,1994-09-23,False,False,8.723,30636
False,/xWBiXclrRmTggQHMRsIn84YHavs.jpg,"[35, 27]",1273221,Scary Movie,en,Scary Movie,"Twenty-six years after outrunning a suspiciously familiar masked killer, the Core Four are back in the killer's crosshairs and no horror movie IP is safe.",192.3462,/reZ8NInXjMkkaOpUHcI3Pn7iaRN.jpg,2026-06-03,False,False,5.543,362
False,/kEiQORCwEXSeoG4SK0e4sezHboJ.jpg,"[35, 28]",1451344,Husbands in Action,ko,남편들,A detective teams up with his ex-wife's new husband to chase down her kidnappers. Can this unlikely duo put aside their differences for one wild rescue?,75.861,/rdmXkKPjGw43u4wp3aod4aIPiH.jpg,2026-06-15,False,False,7.462,53
False,/dd31qJxOarrHyGZwYsCzOjobQzP.jpg,"[28, 53]",1380291,Tom Clancy's Jack Ryan: Ghost War,en,Tom Clancy's Jack Ryan: Ghost War,"Jack Ryan is reluctantly pulled back into espionage when an international covert mission unravels a deadly conspiracy. Racing against time, he joins CIA allies Mike November & James Greer and sharp MI6 officer Emma Marlowe to battle a rogue black-ops unit in a high-stakes, deeply personal fight.",92.441,/8ehYxUh5MWE41AeE9gkHE8DKzvB.jpg,2026-05-20,False,False,7.041,616
False,/4BtL2vvEufDXDP4u6xQjjQ1Y2aT.jpg,"[28, 80, 18, 53]",1419406,The Shadow's Edge,zh,捕风追影,Macau Police brings the tracking expert police officer out of retirement to help catch a dangerous group of professional thieves.,91.107,/cHKo3m8N1fwvEy2ZEr0xGmmMODV.jpg,2025-08-16,False,False,7.809,902
False,/g2aOpyCO1vEyUZURh3V5uaHu187.jpg,"[28, 53]",1288341,Seven Snipers,en,Seven Snipers,"When a former elite sniper is hunted down by the ruthless warlord who once held her captive, she must fight to the death to protect the daughter she has raised in hiding, on a remote Australian farm.",97.1635,/pK6tGCG6UAgUT5FTq3ylGErHxQQ.jpg,2026-04-30,False,False,5.7,38
False,/zyqAhNJqwiop5yUOJ8SHV27labY.jpg,"[28, 53, 878]",949536,Kill Code,en,Kill Code,"North America has been divided into four main quadrants. A power-hungry corporation has taken over the conventional prison system and made criminals the new law enforcers.  The owner of that corporation, nanoscientist Eion Prescott, created a nano-virus called Onyx. Which is distributed through deadly watches to criminals. First, infecting them. Then, forcing them into eliminating each other for freedom. Who can topple the corporation's entire system from within?",92.6417,/bXvSKLCillha6wxY0yxoRCM2WQl.jpg,2026-04-16,False,False,5.5,12
False,/6kheApG5qPsKbiKDxsGpOb6i6i6.jpg,[27],1694978,Chum,en,Chum,"A newlywed couple joins friends on a Mediterranean yacht excursion, only to find themselves caught between a predatory shark and a psychopathic killer in their midst-transforming a sun-drenched escape into a fight for survival.",81.792,/uJOW6pWxJ0i5sji9VXRR6Y1wXyE.jpg,2026-05-27,False,False,4.8,19
False,/62a8bMDftwD9aU0dkXr4eN6Q5q2.jpg,"[99, 10770]",1522126,1000 Men and Me: The Bonnie Blue Story,en,1000 Men and Me: The Bonnie Blue Story,"Adult content creator Bonnie Blue announced that she’d slept with 1057 men in 12 hours. Exploring the polarising debate around Bonnie and the pornification of our society, the film follows her over the most eye-opening six months of her life.",81.3687,/5dcgoyf8nt6Xt4VSR6Nrn6nwhuz.jpg,2025-07-29,False,False,5.2,22
False,/5AsIFZ2AJC7JcGpq40aRPuRuaRc.jpg,[18],1241752,Rita,tl,Rita,"Rita, who finds herself alone when husband Ariel works abroad. They both find solace and sexual satisfaction in other people. When Ariel comes back, they both act like nothing happened. But will this keep their marriage from falling apart?",82.7882,/pXENxAzOBrTSDJGxDcUnlNTNmWr.jpg,2024-03-22,False,False,6.0,24
False,/qY7zVZ7liULhfRoXg4c9Xl83LcR.jpg,[27],1430077,Hokum,en,Hokum,"When novelist Ohm Bauman retreats to a remote inn to scatter his parents' ashes, he is consumed by tales of a witch haunting the honeymoon suite. Disturbing visions and a shocking disappearance forces him to confront dark corners of his past.",77.436,/jKPWwsbAM6HKURPYQ1eG8DmKMKn.jpg,2026-04-29,False,False,6.916,413
False,/kI7JBjvZkqYsLJRhcqTQU1MMdQA.jpg,[35],424711,Poppea's Hot Nights,it,Le calde notti di Poppea,Poppea's Hot Nights (Italian: Le calde notti di Poppea) is a 1969 Italian comedy film set in Ancient Rome. It was written and directed by Guido Malatesta and stars Olga Schoberová (credited as Olinka Berova) and Brad Harris in the main roles.,77.6454,/g1kB4f7aZBJnU2XZILZ8TsyDVVM.jpg,1969-01-01,False,False,4.7,5
False,/osUG3UqNGOJKXIHM2QGNWyKRyCm.jpg,[27],1462591,Hot Line,es,Hot Line,"Malena, a woman who divides her life between two jobs: by night she's a dancer in a cabaret and by day she answers a ""Hot Line,"" an erotic telephone line. However, her routine turns into a nightmare when a serial killer begins calling her, recounting his crimes in chilling detail and announcing that she will be his next victim. This is a clear homage to the Italian Giallo.HoH",73.6404,/aKtKTCmHLoQc9JGr2TehyzL54Yq.jpg,2025-10-28,False,False,10.0,1
False,/vjMvFSmGUxEtqVdaZgvFee9XkZl.jpg,"[878, 28, 12]",969681,Spider-Man: Brand New Day,en,Spider-Man: Brand New Day,Fighting crime full-time as Spider-Man in a world that doesn't remember him—and the pressure of seeing his old friends move on without him—sparks a change in Peter Parker he may not have the power to control. But that transformation might also be the only thing that can stop a shocking new threat to the city and those he loves - a powerful villain no one can even see.,74.2206,/yyB2VJEW3an2xCdcYCPQhn9QERR.jpg,2026-07-29,False,False,0.0,0
False,/xMoXsOgF0hBP7iVj7ZPIrFtTeL3.jpg,"[12, 16, 35, 10751, 14]",1315772,Minions & Monsters,en,Minions & Monsters,"This is the rambunctious, ridiculous and totally true story of how the Minions conquered Hollywood, became movie stars, lost everything, unleashed monsters onto the world and then banded together to try and save the planet from the mayhem they had just created.",79.0398,/nz7i42yhLIJ4ve9JKgM6NthoLHO.jpg,2026-06-24,False,False,7.0,15
