adult,backdrop_path,genre_ids,id,title,original_language,original_title,overview,popularity,poster_path,release_date,softcore,video,vote_average,vote_count
False,/wHwoA0K8GO5vTcOSro8viyfxf6m.jpg,"[28, 12]",1305781,Blades of the Guardians,zh,镖人：风起大漠,"Dao Ma, the ""second most wanted fugitive,"" is entrusted by his benefactor, the chief of Mo family clan, to take on a mysterious escort mission-escorting the ""most wanted fugitive"" to Chang'an.",37.7135,/4QZwryGm8l7N5XdEjPchNPl0BV7.jpg,2026-02-17,False,False,7.0,73
False,/fZ5AD2CpUPSk0wRkxz1j6kp5bdG.jpg,"[27, 80, 18]",1543151,King Kaew,th,กิ่งแก้ว,"After a child in her care dies, a young woman is executed for a crime she didn't commit. Now, her spirit seeks justice for her wrongful death.",52.2629,/pPdHuTs4RAdxs0yaXnlxl1AM3f1.jpg,2026-01-29,False,False,2.5,2
False,/be5SIsRGMckO8tU9lrLcIik70Dy.jpg,"[27, 14, 10749]",1246049,Dracula,fr,Dracula,"In late 15th-century Eastern Europe, Prince Vlad II’s bride is brutally murdered. As a result, he renounces God and damns Heaven itself. Cursed with eternal life, Vlad is reborn as Dracula, an immortal warlord who defies fate in a blood-soaked crusade to wrench his lost love back from death.",38.5557,/dYRqA50yd0nB3qBR7AtWEJJQ8q.jpg,2025-07-30,False,False,7.177,1294
False,/6yeVcxFR0j08vlv2OlL6zbewm4D.jpg,"[28, 878, 53]",1265609,War Machine,en,War Machine,"On one last grueling mission during Army Ranger training, a combat engineer must lead his unit in a fight against a giant otherworldly killing machine.",40.7824,/rFhKkXhk7ClU03jQ5rHIApJDwev.jpg,2026-02-12,False,False,7.408,1979
False,/efIhQiHcgAvHyq8nwSlfJNPpoaH.jpg,[27],1536233,The Summoning of Baby Blue,en,The Summoning of Baby Blue,A babysitting gig becomes a nightmare of urban legend when three teens summon Baby Blue. Survival depends on uncovering the past to escape a mother’s wrath from beyond the grave.,33.7429,/fDyjVv5ryBYDiE1sN9mbBbZycBL.jpg,2025-10-15,False,False,4.8,25
False,/vsgprE5Esxj06j6SPKjMN5CL5oM.jpg,[35],222517,Snow White and 7 Wise Men,it,Biancaneve & Co...,The king and the queen conceive Snow White during a sexual relationship in the snow.,29.4686,/yMiM9Zg9JuNy9k1Q7wsyEpwTSQR.jpg,1982-04-03,False,False,4.7,17
False,/6pb3DTtHYh6ChqsmX9yFEX9GXVt.jpg,"[18, 80]",1020047,In the Hand of Dante,en,In the Hand of Dante,"A Vatican priest discovers Dante's original Divine Comedy manuscript. When asked to authenticate it, writer Nick Tosches steals it, while a parallel story follows Dante's quest to create his masterpiece.",38.3281,/nPPIufTBnzEg0d7NoR5RLL1oPra.jpg,2026-06-12,False,False,5.1,21
False,/7QirCB1o80NEFpQGlQRZerZbQEp.jpg,"[10749, 18]",1156594,Our Fault,es,Culpa nuestra,"Jenna and Lion's wedding brings about the long-awaited reunion between Noah and Nick after their breakup. Nick's inability to forgive Noah stands as an insurmountable barrier. He, heir to his grandfather's businesses, and she, starting her professional life, resist fueling a flame that's still alive. But now that their paths have crossed again, will love be stronger than resentment?",36.0336,/yzqHt4m1SeY9FbPrfZ0C2Hi9x1s.jpg,2025-10-15,False,False,7.376,696
False,/hO2jx1H3XafR7Y8QbFgVH1sHTY9.jpg,"[27, 53, 35]",1198994,Send Help,en,Send Help,"Two colleagues become stranded on a deserted island, the only survivors of a plane crash. On the island, they must overcome past grievances and work together to survive, but ultimately, it's a battle of wills and wits to make it out alive.",39.5602,/zbJWVHOtj3ljBzWgL1P8pxP03Up.jpg,2026-01-22,False,False,7.038,1839
False,/9ywA15OAiwjSTvg3cBs9B7kOCBF.jpg,"[18, 10749]",337167,Fifty Shades Freed,en,Fifty Shades Freed,"Believing they have left behind shadowy figures from their past, newlyweds Christian and Ana fully embrace an inextricable connection and shared life of luxury. But just as she steps into her role as Mrs. Grey and he relaxes into an unfamiliar stability, new threats could jeopardize their happy ending before it even begins.",38.9799,/jjPJ4s3DWZZvI4vw8Xfi4Vqa1Q8.jpg,2018-01-17,False,False,6.671,8372
False,/vP7YFt9pP8NPCg4PMBAHO5ILdrQ.jpg,"[28, 53]",44980,Zero Woman 2,ja,Zero WOMAN ＩＩ　警視庁０課の女,"When a valuable suitcase is stolen, the mob, petty criminals, and a beautiful agent from the Elite Zero division are pulled into a battle to settle the score.",36.0233,/sQHeDjwmBQba8E51Mkp5dvgkzeZ.jpg,1995-09-05,False,False,5.0,8
False,/sDu1nL4P9hLV79ZkZkj2ZC1wy2N.jpg,"[28, 18, 80, 53]",208469,XX: Beautiful Weapon,ja,XX ダブルエックス 美しき凶器,"A blind female assassin lives alone in a remote house; her superiors occasionally send her ""clients"" / targets that she shoots right after having sex with them in her completely darkened bedroom.",38.9638,/ckO9ynpyee6KyuefHYXYAtebjpx.jpg,1993-12-22,False,False,8.938,8
False,/dyJvKsNs2KP8qQnAXbRwDjblViy.jpg,"[16, 10751, 14]",129,Spirited Away,ja,千と千尋の神隠し,"A young girl, Chihiro, becomes trapped in a strange new world of spirits. When her parents undergo a mysterious transformation, she must call upon the courage she never knew she had to free her family.",36.0144,/39wmItIWsg5sZMyRUHLkWBcuVCM.jpg,2001-07-20,False,False,8.534,18455
False,/mxdiaM2tsx8M6W3zLgiPwAkhQfq.jpg,"[18, 10749]",744275,After We Fell,en,After We Fell,"Just as Tessa's life begins to become unglued, nothing is what she thought it would be. Not her friends nor her family. The only person that she should be able to rely on is Hardin, who is furious when he discovers the massive secret that she's been keeping. Before Tessa makes the biggest decision of her life, everything changes because of revelations about her family.",36.9493,/dU4HfnTEJDf9KvxGS9hgO7BVeju.jpg,2021-09-01,False,False,7.0,2748
False,/1XAC6RPT01UX9EQGy2JVn5c8pgy.jpg,"[12, 14]",671,Harry Potter and the Philosopher's Stone,en,Harry Potter and the Philosopher's Stone,"Harry Potter has lived under the stairs at his aunt and uncle's house his whole life. But on his 11th birthday, he learns he's a powerful wizard—with a place waiting for him at the Hogwarts School of Witchcraft and Wizardry. As he learns to harness his newfound powers with the help of the school's kindly headmaster, Harry uncovers the truth about his parents' deaths—and about the villain who's to blame.",38.5461,/wuMc08IPKEatf9rnMNXvIDxqP4W.jpg,2001-11-16,False,False,7.899,29693
False,/k24eZq5I3jyz4htPkZCRpnUmBzE.jpg,"[18, 10749]",1156593,Your Fault,es,Culpa tuya,The love between Noah and Nick seems unwavering despite their parents' attempts to separate them. But his job and her entry into college open up their lives to new relationships that will shake the foundations of both their relationship and the Leister family itself.,35.506,/1sQA7lfcF9yUyoLYC0e6Zo3jmxE.jpg,2024-12-26,False,False,7.083,1571
False,/lsFLh0tcvafTom7lADYg4EGtDlY.jpg,"[16, 28, 12]",1599189,剑来院线剧场版 十三之争,zh,剑来院线剧场版 十三之争,,35.0876,/95OnjUQ1mlu7JHvIMcjYL6ah9Ah.jpg,2026-05-01,False,False,0.0,0
False,/aV5YOTVTnO2wYcN2AlNbdgnBYpb.jpg,"[35, 53, 18]",1628448,Maa Behen,hi,माँ बहन,"In this dark comedy, a woman calls her estranged daughters in the middle of the night with chilling news — there's a dead body in her kitchen.",33.5834,/dpQIeEunpgj0C4rngb6OFb4zSd1.jpg,2026-06-04,False,False,6.7,11
False,/xV1EfNSEg6id6juJPr1vM6p9x5X.jpg,"[18, 53, 80]",979,Irreversible,fr,Irréversible,A woman’s lover and her ex-boyfriend take justice into their own hands after she becomes the victim of a rapist. Because some acts can’t be undone. Because man is an animal. Because the desire for vengeance is a natural impulse. Because most crimes remain unpunished.,34.2817,/rxeDxo8FvZpLu6iplNpxdtAVnfu.jpg,2002-05-22,False,False,7.2,3324
False,/uZr793pQJJZJBjUJYrY9EC32jUL.jpg,"[35, 18]",1510767,Athiradi,ml,അതിരടി,"Energetic student Samkutty revives a banned college festival, igniting a fierce rivalry that transforms celebration into chaos.",31.9172,/vbYoC9wmfo2w7EDVXYrnX4PRBWr.jpg,2026-05-14,False,False,7.2,9
False,/rw1WmxUvmbwRsbAX12m6toIg04j.jpg,"[10749, 35, 18]",1325734,The Drama,en,The Drama,A happily engaged couple is put to the test when an unexpected turn sends their wedding week off the rails.,37.6125,/qhGCY6DIemLoCi7x1GuEt98m4JF.jpg,2026-04-01,False,False,6.963,1092
False,,[35],1522333,Carry On Jatta 4,pa,Carry On Jatta 4,"""Carry On Jatta 4"" is the fourth installment of the iconic Punjabi comedy franchise, produced by Humble Motion Pictures, set for release on June 26, 2026. Expect a hilarious rollercoaster of misunderstandings, quirky characters, and laugh-out-loud moments, continuing the legacy of the beloved series.",57.8085,/bKa9qAg71Kkjz0tOT1gxSAX9Nfv.jpg,2026-06-26,False,False,0.0,0
False,/sRvXNDItGlWCqtO3j6wks52FmbD.jpg,"[16, 35, 14, 12, 10751]",808,Shrek,en,Shrek,"It ain't easy bein' green -- especially if you're a likable (albeit smelly) ogre named Shrek. On a mission to retrieve a gorgeous princess from the clutches of a fire-breathing dragon, Shrek teams up with an unlikely compatriot -- a wisecracking donkey.",37.0038,/iB64vpL3dIObOtMZgX3RqdVdQDc.jpg,2001-05-18,False,False,7.8,18855
False,/oiwc338EoBgS4sEI2ixAny4KQKg.jpg,"[12, 14, 28]",120,The Lord of the Rings: The Fellowship of the Ring,en,The Lord of the Rings: The Fellowship of the Ring,"Young hobbit Frodo Baggins, after inheriting a mysterious ring from his uncle Bilbo, must leave his home in order to keep it from falling into the hands of its evil creator. Along the way, a fellowship is formed to protect the ringbearer and make sure that the ring arrives at its final destination: Mt. Doom, the only place where it can be destroyed.",41.7005,/6oom5QYQ2yQTMJIbnvbkBL9cHo6.jpg,2001-12-18,False,False,8.436,27728
False,/z3bzhmC0CPikWeerUkLO73YvGrC.jpg,"[10402, 53, 28, 27]",1084187,Pretty Lethal,en,Pretty Lethal,A troupe of ballerinas find themselves fighting for survival as they attempt to escape from a remote inn after their bus breaks down on the way to a dance competition.,43.0763,/znTPnXCK3lEQJgqXCvP7e5FUz6f.jpg,2026-03-13,False,False,6.769,422
False,/zxi6WQPVc0uQAG5TtLsKvxYHApC.jpg,"[16, 28, 14, 12]",980477,Ne Zha 2,zh,哪吒之魔童闹海,"After a catastrophic event leaves their bodies destroyed, Ne Zha and Ao Bing are granted a fragile second chance at life. As tensions rise between the dragon clans and celestial forces, the two must undergo a series of perilous trials that will test their bond, challenge their identities, and decide the fate of both mortals and immortals.",34.9675,/cb5NyNrqiCNNoDkA8FfxHAtypdG.jpg,2025-01-29,False,False,8.158,731
False,/gfRm3ITRJuFm8n6gRJ0L2VLrL5w.jpg,"[80, 18, 53]",847742,Drishyam 3,ml,ദൃശ്യം 3,"To protect his family and their dark secret, Georgekutty faces an organized new threat. As walls close in and cracks widen, how much more is he willing to sacrifice ?",36.5073,/456FlpiU1iOBnaOxSd783QhZKWw.jpg,2026-05-21,False,False,7.25,10
False,/euUEDjof7fVX2t3nYFvLLN9ADK2.jpg,"[35, 10402, 18]",1284016,Power Ballad,en,Power Ballad,"When Rick, a past-his-prime wedding singer, meets fading boy-band star Danny during a gig, the two bond over music and a late-night jam session. But when Danny turns one of Rick’s songs into the hit that reignites his career, Rick sets out to reclaim the recognition he believes he deserves - even if it means risking everything he cares about.",35.5949,/sGgX2K0SJqw90Ju8TONdhDVwlzT.jpg,2026-05-18,False,False,7.3,38
False,/wCuUKiRaz0wEESsYqmQy005xvTE.jpg,"[35, 53, 18]",496243,Parasite,ko,기생충,"All unemployed, Ki-taek's family takes peculiar interest in the wealthy and glamorous Parks for their livelihood until they get entangled in an unexpected incident.",34.1268,/7IiTTgloJzvGI1TAYymCfbfl3vT.jpg,2019-05-30,False,False,8.493,20783
False,/cOoVcVQ3i1m5b2xtqKBtoTSbxC1.jpg,"[28, 35, 878]",533535,Deadpool & Wolverine,en,Deadpool & Wolverine,"A listless Wade Wilson toils away in civilian life with his days as the morally flexible mercenary, Deadpool, behind him. But when his homeworld faces an existential threat, Wade must reluctantly suit-up again with an even more reluctant Wolverine.",33.5473,/8cdWjvZQUExUUTzyp4t6EDMubfO.jpg,2024-07-24,False,False,7.6,8825
False,/xA6AM5MvEkieZKlv1Tn3sN23I7i.jpg,"[28, 18, 10749]",1630423,My Dearest Assassin,th,เลือดรักนักฆ่า,"Hunted for her rare blood type, a caged woman vows to fight alongside the assassin she loves to protect their future when an old enemy resurfaces.",35.6285,/ul4dQcA68mtSx8J56N5gEcaCCtP.jpg,2026-05-06,False,False,8.639,255
False,/xuesjsDedl4jrdKcFeDmtjP6ZXo.jpg,"[16, 35, 14, 12, 10751]",1117898,The Cat in the Hat,en,The Cat in the Hat,"Doing what he does best, the Cat spreads joy to kids in his hilarious, signature, and singularly irreverent way, transporting them and audiences on a fantastical journey through a world they've never seen before. Our hero takes on his toughest assignment yet for the I.I.I.I. (Institute for the Institution of Imagination and Inspiration, LLC) to cheer up Gabby and Sebastian, a pair of siblings struggling to move to a new town. Known for taking things too far, this could be this agent of chaos' last chance to prove himself...or lose his magical hat!",37.1711,/mWN6knIVJ2o7eGwSm7mOgSCwNUc.jpg,2026-11-05,False,False,0.0,0
False,/7hpjuCnhkzfInT9INo8WDCLYq6s.jpg,"[18, 10749]",927611,Dangerous Relationship: Professor and Female College Student,ko,위험한 관계: 교수와 여대생,"Jin Yi feels skeptical about her accustomed life as a high-class prostitute. The life she wants to run away from. She has a crush on the newly joined boxer Doo San and wants to leave with him, but Doo San decides to stay, contrary to Jin Yi's wishes. On the other hand, Yeon Soo struggled to enter the music school, but continuing her college life alone, she couldn't keep up with her studies and working part-time. A performance wearing a short skirt, ready to give her body to the professor in charge. But the professor in charge doesn't even blink.",36.0802,/3nkTc0zJlzB6oZoOGC89UFm2yW0.jpg,2021-04-01,False,False,6.0,2
False,/2wssSN9oE8kr2pXTKiidcqZrH0A.jpg,"[27, 9648]",1463681,Southern Scares,en,Southern Scares,"Mystery, horror, and Southern folklore collide in the 1990s when a video store worker discovers chilling secrets found in her missing sister's documentary series, Southern Scares.",35.4699,/fxb0FoBH6e5NJwdVKiwjMAQzvcy.jpg,2026-01-10,False,False,4.0,1
False,/Af907x5h9W1wVis8XrSd7ynTWuy.jpg,"[35, 18]",1314481,The Devil Wears Prada 2,en,The Devil Wears Prada 2,"Andy Sachs returns to Runway as Miranda Priestly navigates a new media landscape and Runway's position within. The duo reconnect with former assistant Emily Charlton, now the head of a luxury brand that possesses funding which could ensure Runway's survival.",34.4121,/xTI42pmsP5EDnvsNJPEDubwWBQO.jpg,2026-04-29,False,False,6.549,840
False,/xnHVX37XZEp33hhCbYlQFq7ux1J.jpg,"[18, 10749]",597,Titanic,en,Titanic,"101-year-old Rose DeWitt Bukater tells the story of her life aboard the Titanic, 84 years later. A young Rose boards the ship with her mother and fiancé. Meanwhile, Jack Dawson and Fabrizio De Rossi win third-class tickets aboard the ship. Rose tells the whole story from Titanic's departure through to its death—on its first and last voyage—on April 15, 1912.",31.8083,/9xjZS2rlVxm8SFx8kPC3aIGCOYQ.jpg,1997-12-18,False,False,7.902,27269
False,/7RyHsO4yDXtBv1zUU3mTpHeQ0d5.jpg,"[12, 878, 28]",299534,Avengers: Endgame,en,Avengers: Endgame,"After the devastating events of Avengers: Infinity War, the universe is in ruins due to the efforts of the Mad Titan, Thanos. With the help of remaining allies, the Avengers must assemble once more in order to undo Thanos' actions and restore order to the universe once and for all, no matter what consequences may be in store.",33.5666,/ulzhLuWrPK07P1YkdWQLZnQh1JL.jpg,2019-04-24,False,False,8.237,27910
False,/yw8FhuMvhJSy4zotEuCyk5bZ230.jpg,"[12, 18, 53, 28]",1284465,The Death of Robin Hood,en,The Death of Robin Hood,"Grappling with his past after a life of crime and murder, Robin Hood finds himself gravely injured after a battle he thought would be his last. In the hands of a mysterious woman, he is offered a chance at salvation.",33.3754,/4cD7KeABHyzeJmzdA6QKe36fp2d.jpg,2026-06-18,False,False,6.7,33
False,/hSVVwSFbgPMnrMKLu3hl4RtTKv1.jpg,"[18, 10749]",39688,Like a Brother,fr,Comme un frère,"Sebastien is a small town boy who moves to Paris and begins to explore the gay night life there. When a friend from back home calls to announce he's coming to Paris, Sebastien confronts some unrequited feelings.",40.9792,/tiAKYNJEpMnS8L1nKqEYC5yjm0C.jpg,2005-04-17,False,False,4.2,24
False,/2fuXHiUrCMp100jC6e4k2H222Jn.jpg,"[35, 878, 80]",1227877,I Love Boosters,en,I Love Boosters,A group of shoplifters take aim at a cutthroat fashion maven by stealing from her stores and reselling them at a lower price — what they call 'fashion-forward philanthropy'.,33.3002,/4pNKIUFy7tkZiBx0rnSmG9ysRy.jpg,2026-05-21,False,False,5.865,52
False,/gK9SAt53CA9Cu9M1UToEgEArl9I.jpg,[],1553566,杨门女将之八妹游春,zh,杨门女将之八妹游春,,23.5973,/qFj9NtTMS36EayxIjoIqcpugupW.jpg,2001-11-12,False,False,0.0,0
False,/7IwBgIwoHtkQ0lYGbBbqKintSWx.jpg,"[27, 35, 28]",1292695,They Will Kill You,en,They Will Kill You,"A woman answers a help wanted ad to be a housekeeper in a mysterious New York City high-rise, unaware that she is entering a community that has seen a number of disappearances over the years and may be under the grip of a Satanic cult.",34.114,/nSXCFSvI2p5WLgMrOHACbVnEJSR.jpg,2026-03-25,False,False,7.008,831
False,/8ZTVqvKDQ8emSGUEMjsS4yHAwrp.jpg,"[28, 878, 12]",27205,Inception,en,Inception,"Cobb, a skilled thief who commits corporate espionage by infiltrating the subconscious of his targets is offered a chance to regain his old life as payment for a task considered to be impossible: ""inception"", the implantation of another person's idea into a target's subconscious.",40.2219,/xlaY2zyzMfkhk0HSC5VUwzoZPU1.jpg,2010-07-15,False,False,8.372,39430
False,/vL5LR6WdxWPjLPFRLe133jXWsh5.jpg,"[878, 28, 12]",19995,Avatar,en,Avatar,"In the 22nd century, a paraplegic Marine is dispatched to the moon Pandora on a unique mission, but becomes torn between following orders and protecting an alien civilization.",31.668,/gKY6q7SjCkAU6FqvqWybDYgUKIF.jpg,2009-12-16,False,False,7.607,34109
False,/qU7tNIMpRqkizIObXfkJY3haTqh.jpg,"[18, 10402, 10749]",27,9 Songs,en,9 Songs,"Matt, a young glaciologist, soars across the vast, silent, icebound immensities of the South Pole as he recalls his love affair with Lisa. They meet at a mobbed rock concert in a vast music hall - London's Brixton Academy. They are in bed at night's end. Together, over a period of several months, they pursue a mutual sexual passion whose inevitable stages unfold in counterpoint to nine live-concert songs.",32.7814,/91O7z0vo7MiNWd5xD2BoivwbQsb.jpg,2004-07-16,False,False,5.537,582
False,/c6OLXfKAk5BKeR6broC8pYiCquX.jpg,"[18, 53]",550,Fight Club,en,Fight Club,"A ticking-time-bomb insomniac and a slippery soap salesman channel primal male aggression into a shocking new form of therapy. Their concept catches on, with underground ""fight clubs"" forming in every town, until an eccentric gets in the way and ignites an out-of-control spiral toward oblivion.",34.0383,/jSziioSwPVrOy9Yow3XhWIBDjq1.jpg,1999-10-15,False,False,8.4,32225
False,/mQZJoIhTEkNhCYAqcHrQqhENLdu.jpg,"[10751, 16, 878, 12]",1184918,The Wild Robot,en,The Wild Robot,"After a shipwreck, an intelligent robot called Roz is stranded on an uninhabited island. To survive the harsh environment, Roz bonds with the island's animals and cares for an orphaned baby goose.",34.8036,/eG9lz41mJqsI4J6ubMtVqD26q2J.jpg,2024-09-12,False,False,8.315,6190
False,/oV472EbPedkc5QzqolGc7sCgCnn.jpg,"[27, 28, 53]",1110034,Kraken,no,Kraken,"A marine biologist is doing research on a fish farm when she encounters several strange occurrences. Along with the brutal deaths of two teenagers, all signs point to the deep fjord; can there be more to the depths than the eye can see?",26.5326,/xdZ8k5s8DTwWyPBMIcflrYLgcAK.jpg,2026-02-06,False,False,6.431,175
False,/lkDYN0whyE82mcM20rwtwjbniKF.jpg,"[28, 18]",911430,F1,en,F1,Racing legend Sonny Hayes is coaxed out of retirement to lead a struggling Formula 1 team—and mentor a young hotshot driver—while chasing one more chance at glory.,32.9378,/9PXZIUsSDh4alB80jheWX4fhZmy.jpg,2025-06-25,False,False,7.8,4148
False,/6ELCZlTA5lGUops70hKdB83WJxH.jpg,"[28, 14, 12]",460465,Mortal Kombat,en,Mortal Kombat,"Washed-up MMA fighter Cole Young, unaware of his heritage, and hunted by Emperor Shang Tsung's best warrior, Sub-Zero, seeks out and trains with Earth's greatest champions as he prepares to stand against the enemies of Outworld in a high stakes battle for the universe.",30.1522,/ybrX94xQm8lXYpZAPRmwD9iIbWP.jpg,2021-04-07,False,False,7.049,6830
False,/sDTnMOJ3H5wI38OxObmCtK7wfd5.jpg,"[16, 35, 10751, 14]",585,"Monsters, Inc.",en,"Monsters, Inc.","Lovable Sulley and his wisecracking sidekick Mike Wazowski are the top scare team at Monsters, Inc., the scream-processing factory in Monstropolis. When a little girl named Boo wanders into their world, it's the monsters who are scared silly, and it's up to Sulley and Mike to keep her out of sight and get her back home.",30.9322,/wFSpyMsp7H0ttERbxY7Trlv8xry.jpg,2001-11-01,False,False,7.852,19866
False,/twsxsfao6ZOVvT8LfudH603MMi6.jpg,"[28, 16, 35, 10751, 878]",519182,Despicable Me 4,en,Despicable Me 4,"Gru and Lucy and their girls—Margo, Edith and Agnes—welcome a new member to the Gru family, Gru Jr., who is intent on tormenting his dad. Gru also faces a new nemesis in Maxime Le Mal and his femme fatale girlfriend Valentina, forcing the family to go on the run.",28.3383,/wWba3TaojhK7NdycRhoQpsG0FaH.jpg,2024-06-20,False,False,7.0,3226
False,/w3Bi0wygeFQctn6AqFTwhGNXRwL.jpg,"[14, 10402, 35, 16]",803796,KPop Demon Hunters,en,KPop Demon Hunters,"When K-pop superstars Rumi, Mira and Zoey aren't selling out stadiums, they're using their secret powers to protect their fans from supernatural threats.",38.98,/zT7Lhw3BhJbMkRqm9Zlx2YGMsY0.jpg,2025-06-20,False,False,8.021,2931
False,/9xfDWXAUbFXQK585JvByT5pEAhe.jpg,"[16, 28, 12, 878]",569094,Spider-Man: Across the Spider-Verse,en,Spider-Man: Across the Spider-Verse,"After reuniting with Gwen Stacy, Brooklyn’s full-time, friendly neighborhood Spider-Man is catapulted across the Multiverse, where he encounters the Spider Society, a team of Spider-People charged with protecting the Multiverse's very existence. But when the heroes clash on how to handle a new threat, Miles finds himself pitted against the other Spiders and must set out on his own to save those he loves most.",32.8062,/8Vt6mWEReuy4Of61Lnj5Xj704m8.jpg,2023-05-31,False,False,8.337,8705
False,/tPpYGm2mVecue7Bk3gNVoSPA5qn.jpg,"[28, 12, 878]",315635,Spider-Man: Homecoming,en,Spider-Man: Homecoming,"Following the events of Captain America: Civil War, Peter Parker, with the help of his mentor Tony Stark, tries to balance his life as an ordinary high school student in Queens, New York City, with fighting crime as his superhero alter ego Spider-Man as a new threat, the Vulture, emerges.",30.4497,/c24sv2weTHPsmDa7jEMN0m2P3RT.jpg,2017-07-05,False,False,7.33,23252
False,/dZ8BVgAMxUpM9t5flLeQbtTX7Zq.jpg,"[18, 53, 28]",1372,Blood Diamond,en,Blood Diamond,"An ex-mercenary turned smuggler. A Mende fisherman. Amid the explosive civil war overtaking 1999 Sierra Leone, these men join for two desperate missions: recovering a rare pink diamond of immense value and rescuing the fisherman's son, conscripted as a child soldier into the brutal rebel forces ripping a swath of torture and bloodshed countrywide.",28.7163,/tnLxPpajkbVdbQl5B9CuD7sSpz9.jpg,2006-12-08,False,False,7.561,8362
False,/2okNnNRrFPZHwCqZg21kVn3uIsC.jpg,"[53, 27, 35]",1266127,Ready or Not: Here I Come,en,Ready or Not: Here I Come,"Moments after surviving an all-out attack from the Le Domas family, Grace discovers she’s reached the next level of the nightmarish game — and this time with her estranged sister Faith at her side. Grace has one chance to survive, keep her sister alive, and claim the High Seat of the Council that controls the world. Four rival families are hunting her for the throne, and whoever wins rules it all.",30.4866,/13ZcJzSGEqVgDSqsS9U5EkQwPkV.jpg,2026-03-19,False,False,7.694,1114
False,/nnmbJvYyDS1VkMOCbxSpdBi3WbJ.jpg,"[28, 18, 36]",1579,Apocalypto,en,Apocalypto,"Set in the Mayan civilization, when a man's idyllic presence is brutally disrupted by a violent invading force, he is taken on a perilous journey to a world ruled by fear and oppression where a harrowing end awaits him. Through a twist of fate and spurred by the power of his love for his woman and his family he will make a desperate break to return home and to ultimately save his way of life.",29.5213,/cRY25Q32kDNPFDkFkxAs6bgCq3L.jpg,2006-12-07,False,False,7.643,6447
False,/2eW8VlLXjUq4OKk8SYf5KTr91Kv.jpg,[35],4258,Scary Movie 5,en,Scary Movie 5,"Home with their newly-formed family, happy parents Dan and Jody are haunted by sinister, paranormal activities. Determined to expel the insidious force, they install security cameras and discover their family is being stalked by an evil dead demon.",25.7742,/vBqLLxE6GaAPhO6v9EFvFbLZ7Ap.jpg,2013-04-11,False,False,4.795,3070
False,/hofnlIyF6bePkgQOpcuRWLvzf15.jpg,"[16, 10751, 14]",14836,Coraline,en,Coraline,"Wandering her rambling old house in her boring new town, 11-year-old Coraline discovers a hidden door to a strangely idealized version of her life. In order to stay in the fantasy, she must make a frighteningly real sacrifice.",30.4836,/4jeFXQYytChdZYE9JYO7Un87IlW.jpg,2009-02-05,False,False,7.9,9070
