adult,backdrop_path,genre_ids,id,title,original_language,original_title,overview,popularity,poster_path,release_date,softcore,video,vote_average,vote_count
False,/6ELCZlTA5lGUops70hKdB83WJxH.jpg,"[28, 14, 12]",460465,Mortal Kombat,en,Mortal Kombat,"Washed-up MMA fighter Cole Young, unaware of his heritage, and hunted by Emperor Shang Tsung's best warrior, Sub-Zero, seeks out and trains with Earth's greatest champions as he prepares to stand against the enemies of Outworld in a high stakes battle for the universe.",30.1522,/nkayOAUBUu4mMvyNf9iHSUiPjF1.jpg,2021-04-07,False,False,7.0,6831
False,/mVr0UiqyltcfqxbAUcLl9zWL8ah.jpg,"[878, 18]",335984,Blade Runner 2049,en,Blade Runner 2049,"Thirty years after the events of the first film, a new blade runner, LAPD Officer K, unearths a long-buried secret that has the potential to plunge what's left of society into chaos. K's discovery leads him on a quest to find Rick Deckard, a former LAPD blade runner who has been missing for 30 years.",31.1278,/gajva2L0rPYkEWjzgFlBXCAVBE5.jpg,2017-10-04,False,False,7.6,15227
False,,"[28, 80, 53]",755679,Fast Forever,en,Fast Forever,The eleventh and final installment in The Fast Saga. Plot TBA.,30.7845,/xaRzhQZ3zK5lN6vEetG8PD17KPF.jpg,2028-03-16,False,False,0.0,0
False,/b6HWTOxn1xevvyHU2K9ICvaRU6g.jpg,"[14, 18, 80]",497,The Green Mile,en,The Green Mile,"A supernatural tale set on death row in a Southern prison, where gentle giant John Coffey possesses the mysterious power to heal people's ailments. When the cell block's head guard, Paul Edgecomb, recognizes Coffey's miraculous gift, he tries desperately to help stave off the condemned man's execution.",30.7302,/8VG8fDNiy50H4FedGwdSVUPoaJe.jpg,1999-12-10,False,False,8.5,19366
False,/cz4vLJrmaV1zJlRYbxqtvLzeLWB.jpg,"[28, 35, 80, 9648]",1168190,The Wrecking Crew,en,The Wrecking Crew,"Estranged half-brothers Jonny and James reunite after their father's mysterious death. As they search for the truth, buried secrets reveal a conspiracy threatening to tear their family apart.",31.2997,/gbVwHl4YPSq6BcC92TQpe7qUTh6.jpg,2026-01-28,False,False,7.039,1094
False,/dzWGnIAjUafpmY57F6vnm44FwWB.jpg,"[18, 10751, 35]",1671548,Dear You,zh,给阿嬷的情书,"Xiaowei travels to Thailand to find his ""billionaire grandfather"" who is out of contact due to debt problems, but unexpectedly find the one who has been corresponding with his grandmother for years is not her husband.",29.5587,/rjmhzdVS3Ia535pFawju857e2Na.jpg,2026-04-30,False,False,9.177,31
False,/1PtqEQ8gu2U9DarYO0JkGX1DTZg.jpg,"[9648, 878]",1083884,Signal One,en,Signal One,"A computer scientist is invited by a tech billionaire to join his private facility on a Caribbean island to investigate extraterrestrial matter on Earth. When they make contact beyond our world, chaos erupts as we’re left to wonder: do they come in peace?",33.7133,/bi7Aeaozl51cd5K6vAn8tI1lOW0.jpg,2026-06-05,False,False,6.8,25
False,/zQ8AxTPiCiS5nnwXpwTBPBHSaa5.jpg,"[28, 878]",557,Spider-Man,en,Spider-Man,"After being bitten by a genetically altered spider at Oscorp, nerdy but endearing high school student Peter Parker is endowed with amazing powers to become the superhero known as Spider-Man.",31.3182,/kjdJntyBeEvqm9w97QGBdxPptzj.jpg,2002-05-01,False,False,7.332,20762
False,/1I6QPJ2s6lch1WYO54Cv2j2Y8Z4.jpg,[35],1217584,Torrente for President,es,Torrente Presidente,"Years have passed since his last adventure, but José Luis Torrente, the most politically incorrect former cop in Spain, still sees himself as a national hero.",57.0269,/yrDKwAdZRJjoQ9RZwzRGPpMC7U1.jpg,2026-03-13,False,False,6.18,50
False,/bVGHSe47W6oCQL1Q88pvRAet51A.jpg,"[18, 9648]",1330021,Remarkably Bright Creatures,en,Remarkably Bright Creatures,"Through unlikely bonds formed during night shifts at a local aquarium, Tova, an elderly widow, learns of a life-changing discovery that may bring her joy and wonder once again.",29.3859,/9HcEqn3D4J6b2Z0jK54id9nA0fr.jpg,2026-05-07,False,False,8.572,671
False,/q8Qlpmp2my1IZV9EVebzvhhJPmy.jpg,"[28, 10749, 53]",1220522,Dacoit,te,డెకాయిట్,"Betrayed by his better half, a man is convicted for a crime he didn't commit. Once free, he hunts her down in pursuit of vengeance, as their stories intertwine with a series of robberies.",29.4066,/lbrnJY7E0a9xxgj2cotNp6YI4dz.jpg,2026-04-10,False,False,6.6,5
False,/9gWrxuOJeArUbvnqrZALSjhPv9Y.jpg,"[36, 28, 12, 10752]",1207162,Rise of the Conqueror,en,Rise of the Conqueror,"In the 14th-century, as the Silk Road crumbles and rival factions tear the land apart, fearless warrior Timur emerges from exile. Stripped of everything, he fights to unite the fractured kingdoms, using strategy and sheer will to carve an empire from chaos. Undefeated in battle and widely regarded as one of history’s greatest military leaders and tacticians, not to mention one of its most brutal, Timur would found the Timurid Empire, which ruled over modern-day Afghanistan, Iran and Central Asia.",28.3979,/9cRE0DsM6CNIiY9Ah3cd8oc3n1Y.jpg,2026-04-09,False,False,6.176,17
False,/mMtUybQ6hL24FXo0F3Z4j2KG7kZ.jpg,"[16, 10749, 18]",372058,Your Name.,ja,君の名は。,"High schoolers Mitsuha and Taki are complete strangers living separate lives. But one night, they suddenly switch places. Mitsuha wakes up in Taki’s body, and he in hers. This bizarre occurrence continues to happen randomly, and the two must adjust their lives around each other.",31.0512,/q719jXXEzOoYaps6babgKnONONX.jpg,2016-07-01,False,False,8.481,12647
False,/kGzFbGhp99zva6oZODW5atUtnqi.jpg,"[18, 80]",240,The Godfather Part II,en,The Godfather Part II,"In the continuing saga of the Corleone crime family, a young Vito Corleone grows up in Sicily and in 1910s New York. In the 1950s, Michael Corleone attempts to expand the family business into Las Vegas, Hollywood and Cuba.",30.2293,/hek3koDUyRQk7FIhPXsa6mT2Zc3.jpg,1974-12-20,False,False,8.57,13999
False,/i8MupUe4xgmYXoRNAQMYvuoexSU.jpg,[27],1038392,The Conjuring: Last Rites,en,The Conjuring: Last Rites,Paranormal investigators Ed and Lorraine Warren take on one last terrifying case involving mysterious entities they must confront.,30.1831,/byWgphT74ClOVa8EOGzYDkl8DVL.jpg,2025-09-03,False,False,6.938,1914
False,/hHDNOlATHhre4eZ7aYz5cdyJLik.jpg,"[27, 53, 878]",1272837,28 Years Later: The Bone Temple,en,28 Years Later: The Bone Temple,Dr. Kelson finds himself in a shocking new relationship - with consequences that could change the world as they know it - and Spike's encounter with Jimmy Crystal becomes a nightmare he can't escape.,29.6511,/kK1BGkG3KAvWB0WMV1DfOx9yTMZ.jpg,2026-01-14,False,False,7.129,1334
