adult,backdrop_path,genre_ids,id,title,original_language,original_title,overview,popularity,poster_path,release_date,softcore,video,vote_average,vote_count
False,/lgotja3xMoJZbynwHfcQcJAEMWH.jpg,"[16, 12, 35, 9648, 10751]",1084242,Zootopia 2,en,Zootopia 2,"After cracking the biggest case in Zootopia's history, rookie cops Judy Hopps and Nick Wilde find themselves on the twisting trail of a great mystery when Gary De'Snake arrives and turns the animal metropolis upside down. To crack the case, Judy and Nick must go undercover to unexpected new parts of town, where their growing partnership is tested like never before.",76.3652,/oJ7g2CifqpStmoYQyaLQgEU32qO.jpg,2025-11-26,False,False,7.672,3000
False,/2VnevJhCTE8bwpkn37JAkceSW5i.jpg,[18],1438392,Euphoria,te,యుఫోరియా,A young woman and her family seek justice after she is raped by a group of young men who come from powerful and influential backgrounds.,63.4397,/8URM569W1ETAeGd33CPkrc6KF1O.jpg,2026-02-06,False,False,3.75,2
False,,[10749],920728,We Want Now,ko,우리 지금 할래,"A man who protects the island and his woman, Soo-hee, live on a remote island that is nothing more than an uninhabited island. And Bok-soon, who lost her mind after being abandoned by the man she loved. This is an island where only three people live, even if they die. Then one day, a photographer who seems to be holding something secret comes to the island. However, the man who guards the island misunderstands the visitor and kills him because of it. Bok-soon, who loved the dead photographer, commits suicide upon seeing the photographer's death. A man who has gone mad after killing someone hears a story from Soo-hee, who lives with him, and only later finds out all the secrets...",74.8215,/mQ95TSIl1QqNWCMQs1lTRgZUWT8.jpg,2016-04-20,False,False,0.0,0
False,/a6VXgWVWjSvUq0UsCPSgUQko4CQ.jpg,"[27, 10749, 53]",1486860,Haunted 3D: Echoes of the Past,hi,Haunted 3D: Echoes of the Past,"A man seeks refuge in a remote Indian mountain mansion, fleeing his past. He discovers the house harbors sinister secrets, pain, and terror ready to torment him.",65.3674,/tSmAFNckiqcKg7aFgjCFnhNqNbP.jpg,2026-06-12,False,False,10.0,1
False,/2ssWTSVklAEc98frZUQhgtGHx7s.jpg,"[12, 18, 878]",157336,Interstellar,en,Interstellar,The adventures of a group of explorers who make use of a newly discovered wormhole to surpass the limitations on human space travel and conquer the vast distances involved in an interstellar voyage.,69.1348,/yQvGrMoipbRoddT0ZR8tPoR7NfX.jpg,2014-11-05,False,False,8.479,40118
False,/dpHoPHMSMkFZWt44FGkpEZ61Ptd.jpg,"[80, 18, 10402, 53]",1340206,Tuner,en,Tuner,"A gifted piano tuner's meticulous skills for tuning pianos lead him to discover an unexpected aptitude for cracking safes, turning his life upside down.",67.05,/5OvA3i9wZs5jHu0DCrfmXlzAM67.jpg,2026-05-21,False,False,7.2,105
False,/9nzfyiYbmTUXWC4B2kwjl4NAlqO.jpg,"[28, 53]",1318447,Apex,en,Apex,A grieving woman pushing her limits on a solo adventure in the Australian wild is ensnared in a twisted game with a cunning killer who thinks she's prey.,65.9018,/eTp7gSPkSF3Aw79mNx1NkBP1PZT.jpg,2026-04-24,False,False,6.823,1534
False,/A7BiqPOKvGNalAZhFn1WfSeG9aO.jpg,"[27, 9648, 53, 10770]",137051,Midnight Matinee,en,Midnight Matinee,"Even though a devastating murder took place during a small town's horror film festival two years earlier, townspeople want another festival.",67.0567,/czam6wq46B9UCZvq85vicElckFq.jpg,1988-10-12,False,False,5.4,7
False,/efIliFJKKKALLO31pxLq3WqguC7.jpg,"[18, 27, 9648]",1219739,Heresy,nl,Witte Wieven,"In a medieval Dutch village, a young woman is caught between her faith, fanatic townsfolk and the dark forces lurking in the woods.",59.8211,/gGStwXLjGe9WaodCCgeVwkDDwS3.jpg,2024-01-25,False,False,6.2,26
False,/tq3h43fZy0H80vzf47MAY7R9Mxo.jpg,"[16, 35, 10751]",1297842,GOAT,en,GOAT,"A small goat with big dreams gets a once-in-a-lifetime shot to join the pros and play roarball, a high-intensity, co-ed, full-contact sport dominated by the fastest, fiercest animals in the world.",61.1014,/wfuqMlaExcoYiUEvKfVpUTt1v4u.jpg,2026-02-11,False,False,8.117,847
False,,"[53, 27]",1359685,El mal,es,El mal,"“El mal is basically a suspense story, where the audience senses that something disturbing is going to happen, but doesn't know how or when. But it also aims to get the viewer to question their own certainties, their capacity to love and to accept their own dark side.”",75.6367,/fZWqXuy6UAgnc9ySFyZhXaB2DoR.jpg,2026-01-16,False,False,0.0,0
False,/4DfxcN4w0FuYZHQ3JAHzpHWia1U.jpg,"[28, 80, 53]",1291608,Dhurandhar,hi,धुरंधर,"A mysterious traveler slips into the heart of Karachi's underbelly and rises through its ranks with lethal precision, only to tear the notorious ISI-Underworld nexus apart from within.",59.6577,/snBOuXDdhmTvlzMUvP9Em3Pp1u1.jpg,2025-12-05,False,False,7.274,312
False,/iZLqwEwUViJdSkGVjePGhxYzbDb.jpg,"[878, 53]",755898,War of the Worlds,en,War of the Worlds,"Will Radford is a top analyst for Homeland Security who tracks potential threats through a mass surveillance program, until one day an attack by an unknown entity leads him to question whether the government is hiding something from him... and from the rest of the world.",64.2875,/yvirUYrva23IudARHn3mMGVxWqM.jpg,2025-07-29,False,False,4.096,1017
False,/r5dG1V4P4y84x6ETQkQ5BnZ0iXh.jpg,[35],140638,"Pussycat, Pussycat, I Love You",en,"Pussycat, Pussycat, I Love You",An American playwright living in Rome consults a quack psychiatrist to combat his fears of balding and save his failing marriage.,67.1515,/5NG3iF6mli8QMJYNsbzWxzW04t4.jpg,1970-03-25,False,False,4.5,23
False,/uAfhsySkr1UzQg1zdg3dZQRz9Fd.jpg,"[16, 10751, 35]",10193,Toy Story 3,en,Toy Story 3,"Woody, Buzz, and the rest of Andy's toys haven't been played with in years. With Andy about to go to college, the gang find themselves accidentally left at a nefarious day care center. The toys must band together to escape and return home to Andy.",55.4565,/AbbXspMOwdvwWZgVN0nabZq03Ec.jpg,2010-06-16,False,False,7.81,15840
False,/7iUDfakacY1HpajP1DtHrCuDB95.jpg,"[16, 35, 10751]",863,Toy Story 2,en,Toy Story 2,"Andy heads off to Cowboy Camp, leaving his toys to their own devices. Things shift into high gear when an obsessive toy collector named Al McWhiggen, owner of Al's Toy Barn kidnaps Woody. Andy's toys mount a daring rescue mission, Buzz Lightyear meets his match and Woody has to decide where he and his heart truly belong.",57.0231,/4rbcp3ng8n1MKHjpeqW0L7Fnpzz.jpg,1999-10-30,False,False,7.613,15002
False,/cLFbDVfhllIMybpo2fkGNzehiQG.jpg,"[12, 53, 878]",840464,Greenland 2: Migration,en,Greenland 2: Migration,"Having found the safety of the Greenland bunker after the comet Clarke decimated the Earth, the Garrity family must now risk everything to embark on a perilous journey across the wasteland of Europe to find a new home.",54.0426,/z2tqCJLsw6uEJ8nJV8BsQXGa3dr.jpg,2026-01-07,False,False,6.435,1249
False,/1N5yz1IDw6Ci8le1YgeM6xtBijA.jpg,"[10749, 35]",1358005,Office Romance,en,Office Romance,"Jackie, President and CEO of Air Cruz, runs a tight ship in her business, including a rigid anti-fraternization policy for all her employees. When a new sexy lawyer begins working for her, that policy becomes very tested.",57.3622,/1HRUTqEVDmJC4L6tp6zd85MI6uH.jpg,2026-06-04,False,False,6.512,259
False,/zTnAnYIn0Iv3cn0ZHlzLhou3ybm.jpg,"[9648, 53]",1368166,The Housemaid,en,The Housemaid,"Trying to escape her past, Millie Calloway accepts a job as a live-in housemaid for the wealthy Nina and Andrew Winchester. But what begins as a dream job quickly unravels into something far more dangerous—a sexy, seductive game of secrets, scandal, and power.",52.113,/cWsBscZzwu5brg9YjNkGewRUvJX.jpg,2025-12-18,False,False,7.266,2505
False,/cfT29Im5VDvjE0RpyKOSdCKZal7.jpg,"[28, 80, 53]",155,The Dark Knight,en,The Dark Knight,"Batman raises the stakes in his war on crime. With the help of Lt. Jim Gordon and District Attorney Harvey Dent, Batman sets out to dismantle the remaining criminal organizations that plague the streets. The partnership proves to be effective, but they soon find themselves prey to a reign of chaos unleashed by a rising criminal mastermind known to the terrified citizens of Gotham as the Joker.",48.9774,/qJ2tW6WMUDux911r6m7haRef0WH.jpg,2008-07-16,False,False,8.531,35966
False,/mDfJG3LC3Dqb67AZ52x3Z0jU0uB.jpg,"[12, 28, 878]",299536,Avengers: Infinity War,en,Avengers: Infinity War,"As the Avengers and their allies have continued to protect the world from threats too large for any one hero to handle, a new danger has emerged from the cosmic shadows: Thanos. A despot of intergalactic infamy, his goal is to collect all six Infinity Stones, artifacts of unimaginable power, and use them to inflict his twisted will on all of reality. Everything the Avengers have fought for has led up to this moment - the fate of Earth and existence itself has never been more uncertain.",56.9694,/7WsyChQLEftFiDOVTGkv3hFpyyt.jpg,2018-04-25,False,False,8.237,32167
False,/AeK2MPOpYrOOgZNfFnfwp0L8tNn.jpg,"[28, 12, 878]",634649,Spider-Man: No Way Home,en,Spider-Man: No Way Home,"Peter Parker is unmasked and no longer able to separate his normal life from the high-stakes of being a super-hero. When he asks for help from Doctor Strange the stakes become even more dangerous, forcing him to discover what it truly means to be Spider-Man.",50.752,/1g0dhYtq4irTY1GPXvft6k4YLjm.jpg,2021-12-15,False,False,7.934,22118
False,/gkh6Nt8DtY1XT4gQsyFq9XAVJlJ.jpg,"[18, 35]",350,The Devil Wears Prada,en,The Devil Wears Prada,"A young woman from the Midwest gets more than she bargained for when she moves to New York to become a writer and ends up as the assistant to the tyrannical, larger-than-life editor-in-chief of a major fashion magazine.",52.4307,/8912AsVuS7Sj915apArUFbv6F9L.jpg,2006-06-29,False,False,7.435,13786
False,/oz4U9eA6ilYf1tyiVuGmkftdLac.jpg,"[18, 10749, 53]",1010581,My Fault,es,Culpa mía,"Noah must leave her city, boyfriend, and friends to move into William Leister's mansion, the flashy and wealthy husband of her mother Rafaela. As a proud and independent 17 year old, Noah resists living in a mansion surrounded by luxury. However, it is there where she meets Nick, her new stepbrother, and the clash of their strong personalities becomes evident from the very beginning.",53.002,/w46Vw536HwNnEzOa7J24YH9DPRS.jpg,2023-06-08,False,False,7.733,4107
False,/abQxLSkGxpHyUxRjRXACt8NbiGf.jpg,"[18, 10749]",48650,Room in Rome,es,Habitación en Roma,"A hotel room in the center of Rome serves as the setting for Alba and Natasha, two sexy and recently acquainted women, to have a physical adventure that touches their very souls.",52.3612,/w90ItYf9qagQKVEBr1uFxPomAtf.jpg,2010-05-07,False,False,6.409,835
False,/euUEDjof7fVX2t3nYFvLLN9ADK2.jpg,"[35, 10402, 18]",1284016,Power Ballad,en,Power Ballad,"When Rick, a past-his-prime wedding singer, meets fading boy-band star Danny during a gig, the two bond over music and a late-night jam session. But when Danny turns one of Rick’s songs into the hit that reignites his career, Rick sets out to reclaim the recognition he believes he deserves - even if it means risking everything he cares about.",35.5949,/sGgX2K0SJqw90Ju8TONdhDVwlzT.jpg,2026-05-18,False,False,7.311,37
False,/apfyLCPVFttB8oXcsLJ7q0NSFLx.jpg,"[53, 36, 10752]",1318413,Pressure,en,Pressure,"In the tense 72 hours before D-Day, and the fate of the free world hanging in the balance, General Dwight D. Eisenhower and Captain James Stagg face an impossible choice—launch the largest and most dangerous seaborne invasion in history or risk losing the war altogether.",50.8488,/gFjEggtrejCN79r6SXRjM269OtG.jpg,2026-05-25,False,False,7.617,98
False,/pjlxrd646cBYznHoPBWTzz6FujX.jpg,"[28, 878, 18]",39254,Real Steel,en,Real Steel,"Charlie Kenton is a washed-up fighter who retired from the ring when robots took over the sport. After his robot is trashed, he reluctantly teams up with his estranged son to rebuild and train an unlikely contender.",48.3237,/4GIeI5K5YdDUkR3mNQBoScpSFEf.jpg,2011-09-28,False,False,7.113,9261
False,/l7UYtsMGay7gjHtqJrAI2SZXIWZ.jpg,[27],1245398,True Fear,sv,Äkta skräck,"When two female best friends hosting an online horror-themed history show together decide to make an episode about the site of a 17th century witch hunt, they find themselves seemingly terrorized by evil supernatural forces.",48.052,/8ZZYWJbKVz1g8gCr5Ghm6V7CwYp.jpg,2024-09-06,False,False,6.6,9
False,/9AJ3GcCsUhoVn3czRU4yxVkSsDE.jpg,[99],1202285,Porn,fr,Porn,,53.9377,/rbzySQcXmTvWOaaJAsFDlCjW8eG.jpg,2023-05-16,False,False,7.4,7
False,/tlm8UkiQsitc8rSuIAscQDCnP8d.jpg,"[28, 878]",603,The Matrix,en,The Matrix,"Set in the 22nd century, The Matrix tells the story of a computer hacker who joins a group of underground insurgents fighting the vast and powerful computers who now rule the earth.",52.3798,/dXNAPwY7VrqMAo51EKhhCJfaGb5.jpg,1999-03-31,False,False,8.249,28079
False,/7B72d6f09eIifSgkpCkzwkv8fle.jpg,"[18, 10749]",1002398,Virgin,tl,Donselya,"Iris, an 18-year old virgin marries Joaquin, a rich widower, because of money. However, when he learns that Iris is not really a virgin, their honeymoon turns to a bloodbath.",49.6179,/iVS3ZiPsKy8Hhc5Dipqgrjmoj2b.jpg,2024-10-29,False,False,6.7,23
False,/sRVg5yfJJQ2emGhl6XPYJssilu.jpg,"[80, 53]",912378,Dridam,ml,ദൃഢം,"A police officer arrives at a seemingly peaceful station but faces pressure when human remains are discovered. Given only a week to solve the murder, he must navigate demands from his department and an anxious public seeking swift justice.",39.914,/fXSdAujfiRRW6LqekN4FvFQidh3.jpg,2026-05-08,False,False,5.0,5
False,,[27],687259,Ghost Stories,zh,镜花风月三之螺女挑情,,52.183,/m4ALMhsuqOOUkkABvgQWfrgoL8y.jpg,1982-01-01,False,False,6.2,2
False,/3eUyLEF5M0ky3h6KJsWiWzaakB8.jpg,"[27, 9648, 80]",1159559,Scream 7,en,Scream 7,"When a new Ghostface killer emerges in the quiet town where Sidney Prescott has built a new life, her darkest fears are realized as her daughter becomes the next target. Determined to protect her family, Sidney must face the horrors of her past to put an end to the bloodshed once and for all.",47.3863,/jjyuk0edLiW8vOSnlfwWCCLpbh5.jpg,2026-02-25,False,False,6.191,1084
False,/cfDHxkco8RrslL0Vk2XPTwTVFCe.jpg,"[28, 53]",1472951,Infiltrate,en,Infiltrate,"In a city overrun by crime, government Agent Lily Chen is forced to choose between her duty and her family when her husband is kidnapped, and she’s blackmailed into assassinating high-level criminals to save him. As she delves deeper into the criminal underworld, Lily’s relentless pursuit of justice unravels a web of corruption, leading to a final, life-altering decision that will change her world forever.",46.0768,/8Cw8GF9wG63kF8pRRXwOx2kXGt.jpg,2026-04-10,False,False,5.7,20
False,/1ytf7rzkZ7RLlMnBdGggQ0ENe6z.jpg,"[27, 53]",1418657,The Yeti,en,The Yeti,"When an oil tycoon and a famous adventurer vanish into the harsh winter of remote northern Alaska, a hand-picked rescue team endeavors to bring them home. What they don’t know is that they are trespassing on The Yeti’s territory, and the elements are the least of their worries.",63.6925,/zaqEfoKcWkVni2eONhJ7DRhMO8Q.jpg,2026-04-04,False,False,6.381,59
False,/2hhTw9geBIVGyJeisfVhdoJpdI4.jpg,"[18, 53]",1351908,Bharat Bhhagya Viddhaata,hi,भारत भाग्य विधाता,"Inside Cama Hospital, one of the sites targeted during the 2008 Mumbai terror attacks, nurses, ward boys, cleaners, lift operators, security personnel, and administrative workers keep 400 people alive while armed assailants struck the city around them.",41.5812,/tf5lLrrikOswHKHpzW0UiHycJEx.jpg,2026-06-12,False,False,0.0,0
False,/aqqoDJs8vYp2EZ74aQ1UMY0sjM7.jpg,"[18, 53]",235271,Addicted,en,Addicted,A gallerist risks her family and flourishing career when she enters into an affair with a talented painter and slowly loses control of her life.,45.8209,/fAERrD6vvmznDoL99wlgjhSfPcH.jpg,2014-10-10,False,False,5.91,449
False,/vmdt6nUXYX4mM0Ahcvh4bgHOjUt.jpg,"[28, 18]",1292415,Beast,en,Beast,"MMA legend Patton James, now a commercial fisherman, is pulled back into the cage when his brother is in danger. Reuniting with his old coach Sammy, he commits to one final fight in one championship against the brutal champion Xavier Grau.",45.393,/7NrvUI3vnW8H3rD7ExKcTL7KRcQ.jpg,2026-04-10,False,False,6.254,61
False,/xS8tsJ8IvNkzBMu3kq3gZFReh7j.jpg,[53],1293550,Bandar,hi,बंदर,"TV star Samar's life spirals when his ex Gayatri accuses him of rape after he blocks contact with her. Despite his new relationship with Khushi, he faces arrest and encounters a corrupt justice system.",39.3488,/3TrQUHmnEL2tOYf4KKkXb01BQt2.jpg,2026-06-05,False,False,6.5,2
False,/sb76azrAXr9U13uEQxNP5e3fujY.jpg,"[28, 35, 53]",1390300,Over Your Dead Body,en,Over Your Dead Body,"A dysfunctional couple head to a remote cabin to ""reconnect"", but each has secret intentions to kill the other.",43.5085,/kZCauMzAt9eMAhLMopCqnFw1Q5k.jpg,2026-03-14,False,False,6.547,344
False,/a4rmHZa1YvEi0GxVvAZujXUQSDc.jpg,[53],1699820,Vibeland Chronicles,en,Vibeland Chronicles,"As the events of a modern day Zodiac killer unfold, different stories, characters, and music intertwine within a surreal San Francisco, also known as Vibeland. From underground criminal labyrinths to violent job application simulations to haunted buses after midnight to dancing serial killers, nothing that happens in Vibeland is ordinary.",41.9026,/wPOjoiO9ZrsYociKXLxrvQfILlK.jpg,2026-01-02,False,False,4.0,1
False,/82lM4GJ9uuNvNDOEpxFy77uv4Ak.jpg,"[28, 878, 12]",1242898,Predator: Badlands,en,Predator: Badlands,"Cast out from his clan, a young Predator finds an unlikely ally in a damaged android and embarks on a treacherous journey in search of the ultimate adversary.",45.3547,/pHpq9yNUIo6aDoCXEBzjSolywgz.jpg,2025-11-05,False,False,7.802,3168
False,/h25oHn8FJHaImp8DneBhDJQHOpM.jpg,[99],17073,American Swing,en,American Swing,Chronicles the rise and fall of 1970s New York City nightclub Plato's Retreat.,40.8078,/d4rfQ9lEq0G1yNUOjHEofXlfk0Z.jpg,2009-10-17,False,False,5.1,18
False,/nyW8YdrnSYtmTE9hgrpmGqkKw5b.jpg,[18],1658216,Stepdaddy,tl,Stepdaddy,Emotions and intrigue run high in this titillating taboo family affair. Chloe and Nica are sisters who both find themselves in their own passionate love affairs with their stepdad Carl.,49.3715,/oZxNblisKuDzSUW5g18FERjyJs9.jpg,2026-04-04,False,False,5.3,3
False,/nHxWyy18SvAZ8jJeemtS8k1UNjM.jpg,"[28, 80, 53]",1290821,Shelter,en,Shelter,"A man living in self-imposed exile on a remote island rescues a young girl from a violent storm, setting off a chain of events that forces him out of seclusion to protect her from enemies tied to his past.",52.9583,/buPFnHZ3xQy6vZEHxbHgL1Pc6CR.jpg,2026-01-28,False,False,7.674,1317
False,/xyW8rJO3rwG2EGcTO6eaUEa8b9d.jpg,"[28, 53]",1613798,Vengeance,es,Venganza,"The brutal murder of the wife of “Toro,” a military hero in the special forces, turns him into a man with a single purpose: revenge. After a stroke of fate makes him a millionaire, Carlos transforms his fortune into an arsenal and, together with his closest soldiers, sets out to hunt down those responsible.",45.8073,/ygWXPL0RS91JyJPNOfK34eV3bRE.jpg,2026-02-26,False,False,7.49,262
False,/m5dA4JZsj78EBTa2D6imWOAebwB.jpg,[35],4247,Scary Movie,en,Scary Movie,"A familiar-looking group of teenagers find themselves being stalked by a more-than-vaguely recognizable masked killer! As the victims begin to pile up and the laughs pile on, none of your favorite scary movies escape the razor-sharp satire of this outrageously funny parody!",38.3731,/fVQFPRuw3yWXojYDJvA5EoFjUOY.jpg,2000-07-07,False,False,6.416,7889
False,/suaEOtk1N1sgg2MTM7oZd2cfVp3.jpg,"[53, 80, 35]",680,Pulp Fiction,en,Pulp Fiction,"A burger-loving hit man, his philosophical partner, a drug-addled gangster's moll and a washed-up boxer converge in this sprawling, comedic crime caper. Their adventures unfurl in three stories that ingeniously trip back and forth in time.",41.1348,/vQWk5YBFWF4bZaofAbv0tShwBvQ.jpg,1994-09-10,False,False,8.482,30339
False,/ejdD20cdHNFAYAN2DlqPToXKyzx.jpg,"[18, 80]",238,The Godfather,en,The Godfather,"Spanning the years 1945 to 1955, a chronicle of the fictional Italian-American Corleone crime family. When organized crime family patriarch, Vito Corleone barely survives an attempt on his life, his youngest son, Michael steps in to take care of the would-be killers, launching a campaign of bloody revenge.",42.3442,/3bhkrj58Vtu7enYsRolD1fZdja1.jpg,1972-03-14,False,False,8.687,23082
False,/9BBTo63ANSmhC4e6r62OJFuK2GL.jpg,"[878, 28, 12]",24428,The Avengers,en,The Avengers,"When an unexpected enemy emerges and threatens global safety and security, Nick Fury, director of the international peacekeeping agency known as S.H.I.E.L.D., finds himself in need of a team to pull the world back from the brink of disaster. Spanning the globe, a daring recruitment effort begins!",44.1002,/RYMX2wcKCBAr24UyPD7xwmjaTn.jpg,2012-04-25,False,False,8.048,38520
False,/sDUGZpt9qmzBIqtFKvgnGnfyBpw.jpg,"[80, 9648, 53]",1679791,M4M: Motive for Murder,te,M4M: Motive for Murder,"Hyderabad is on edge as a serial killer stages murders as famous paintings. ACP Krishna and journalist Radha investigate, uncovering links to a student and a principal, racing to stop the next planned killing.",37.5353,/FcoRfDLRwiAcNCd5SmeDIIeea7.jpg,2026-05-07,False,False,0.0,0
False,,[],1480259,太太日記,cn,太太日記,hong kong film,31.1857,,1965-01-01,False,False,0.0,0
False,/uJK0jjJ8QDOQw5lcNBwu059ht4D.jpg,"[18, 10749]",1294203,My Fault: London,en,My Fault: London,"18-year-old Noah moves from America to London, with her mother who's recently fallen in love with William, a wealthy British businessman. Noah meets William’s son, bad-boy Nick, and soon discovers there is an attraction between them neither can avoid. As Noah spends the summer adjusting to her new life, her devastating past will catch up with her while falling in love for the first time.",39.3147,/ttN5D6GKOwKWHmCzDGctAvaNMAi.jpg,2025-02-12,False,False,7.384,589
False,/jDvxsBemt2Iyslg7qn2WMzgxz23.jpg,"[28, 53, 27]",1375646,Colony,ko,군체,"Professor Se-jeong is thrust into a bloody nightmare when a rapidly mutating virus is released during a biotech conference causing authorities to seal the facility. Trapped inside with no escape, Se-jeong along with a small group of survivors must fight to stay alive while the infected undergo horrific transformations.",42.1842,/tN799oUR0f1gUKDYdMNrDaY7I51.jpg,2026-05-21,False,False,6.979,72
False,/6d3z1PvNeRPla0gwpTWU4q8OOts.jpg,[35],5082,The Traveling Companion,it,La compagna di viaggio,A  ruined noble decides to organize a robbery on a luxury train. He decides to get help from a busty starlet that should distract passengers ...,40.8372,/12lRiKQJXG2ldB8qJPmjHTxeK9w.jpg,1981-01-03,False,False,4.682,11
False,/wRWEA3TeGGyocIPKFiTDzPK3HfN.jpg,[18],405871,On the Beach,ja,令嬢肉奴隷,"In a summer in Shonan village, Sumiko is the daughter of an important upper-class Shikishima family, she loves to paint pictures, is going through a cooling-off of an arranged marriage that did not work out. However, she feels attraction for Nishina a rough and obscene man ...  On the other hand, the younger sister, Naomi Sumiko is envious of her sister for her beauty. Naomi feels ugly since all men seem to like Sumiko. Both sisters then become embroiled in a major problem in discovering the real intentions of Nishina, a man who hides behind a mask to rape women.",56.4449,/ksl1d50FUHaqNuNnmHSNdPrYyYl.jpg,1985-08-24,False,False,5.6,21
False,/eGX66zonvc4bXg3rM08RUxdYSDx.jpg,"[878, 12, 28]",1061474,Superman,en,Superman,"Superman, a journalist in Metropolis, embarks on a journey to reconcile his Kryptonian heritage with his human upbringing as Clark Kent.",41.875,/ldyfo0BKmz5rWtJJKCvwaNS4cJT.jpg,2025-07-09,False,False,7.339,4937
False,/ekFr4AyEpwyIHK1R3VOYDXN2PqL.jpg,"[27, 10749]",1564614,Leviticus,en,Leviticus,Two teenage boys must escape a violent entity that takes the form of the person they desire most — each other.,39.8512,/cu0XnXLzJGPeI0msCoJKgnEecKz.jpg,2026-06-17,False,False,7.3,22
False,/kKF4gEiBDArhONlCcunHVgBp3bA.jpg,"[80, 53]",1171145,Crime 101,en,Crime 101,"When an elusive thief whose high-stakes heists unfold along the iconic 101 freeway in Los Angeles eyes the score of a lifetime, with hopes of this being his final job, his path collides with a disillusioned insurance broker who is facing her own crossroads. Determined to crack the case, a relentless detective closes in on the operation, raising the stakes even higher.",40.0213,/tVvpFIoteRHNnoZMhdnwIVwJpCA.jpg,2026-02-11,False,False,7.0,1111
False,/m3Pom6pbD51bBv3syz8NMHda3fz.jpg,"[12, 28, 14]",1368337,The Odyssey,en,The Odyssey,"Odysseus, the legendary King of Ithaca, embarks on a long and perilous journey home following the Trojan War. Throughout his voyage, he is forced to confront the whims of gods, mythological monsters, and trials that stretch both his cunning and his humanity to the breaking point.",39.6336,/krVa7rKCQb4OBfsr2LTJv4rTz5q.jpg,2026-07-15,False,False,0.0,0
False,/2u7zbn8EudG6kLlBzUYqP8RyFU4.jpg,"[12, 14, 28]",122,The Lord of the Rings: The Return of the King,en,The Lord of the Rings: The Return of the King,"As armies mass for a final battle that will decide the fate of the world--and powerful, ancient forces of Light and Dark compete to determine the outcome--one member of the Fellowship of the Ring is revealed as the noble heir to the throne of the Kings of Men. Yet, the sole hope for triumph over evil lies with a brave hobbit, Frodo, who, accompanied by his loyal friend Sam and the hideous, wretched Gollum, ventures deep into the very dark heart of Mordor on his seemingly impossible quest to destroy the Ring of Power.​",41.8788,/rCzpDGLbOoPwLjy3OAm5NUPOTrC.jpg,2003-12-17,False,False,8.5,26709
